{
  "$schema": "ops/oci-request.schema.json",
  "request_id": "start-evolution-quick-tunnel-20260909-002",
  "operation": "run_instance_command",
  "instance_name": "agendafacil-evolution-v2",
  "script_b64": "IyEvdXNyL2Jpbi9lbnYgYmFzaApzZXQgLWV1byBwaXBlZmFpbAplY2hvICI9PT0gQ0xPVURGTEFSRUQgUVVJQ0sgVFVOTkVMID09PSIKQVJDSD0iJChkcGtnIC0tcHJpbnQtYXJjaGl0ZWN0dXJlKSIKY2FzZSAiJEFSQ0giIGluCiAgYW1kNjQpIFVSTD0iaHR0cHM6Ly9naXRodWIuY29tL2Nsb3VkZmxhcmUvY2xvdWRmbGFyZWQvcmVsZWFzZXMvbGF0ZXN0L2Rvd25sb2FkL2Nsb3VkZmxhcmVkLWxpbnV4LWFtZDY0IiA7OwogIGFybTY0KSBVUkw9Imh0dHBzOi8vZ2l0aHViLmNvbS9jbG91ZGZsYXJlL2Nsb3VkZmxhcmVkL3JlbGVhc2VzL2xhdGVzdC9kb3dubG9hZC9jbG91ZGZsYXJlZC1saW51eC1hcm02NCIgOzsKICAqKSBlY2hvICJ1bnN1cHBvcnRlZF9hcmNoPSRBUkNIIjsgZXhpdCAyIDs7CmVzYWMKc3VkbyBpbnN0YWxsIC1kIC1tIDA3NTUgL3Vzci9sb2NhbC9iaW4Kc3VkbyBjdXJsIC1mc1NMICIkVVJMIiAtbyAvdXNyL2xvY2FsL2Jpbi9jbG91ZGZsYXJlZApzdWRvIGNobW9kIDA3NTUgL3Vzci9sb2NhbC9iaW4vY2xvdWRmbGFyZWQKc3VkbyBwa2lsbCAtZiAnY2xvdWRmbGFyZWQgdHVubmVsIC0tdXJsIGh0dHA6Ly8xMjcuMC4wLjE6ODA4MCcgfHwgdHJ1ZQpzdWRvIHJtIC1mIC92YXIvbGliL2FnZW5kYWZhY2lsL2Nsb3VkZmxhcmVkLmxvZyAvdmFyL2xpYi9hZ2VuZGFmYWNpbC9ldm9sdXRpb24tcHVibGljLXVybApzdWRvIG1rZGlyIC1wIC92YXIvbGliL2FnZW5kYWZhY2lsCnN1ZG8gbm9odXAgL3Vzci9sb2NhbC9iaW4vY2xvdWRmbGFyZWQgdHVubmVsIC0tbm8tYXV0b3VwZGF0ZSAtLXVybCBodHRwOi8vMTI3LjAuMC4xOjgwODAgPiAvdmFyL2xpYi9hZ2VuZGFmYWNpbC9jbG91ZGZsYXJlZC5sb2cgMj4mMSAmCnNsZWVwIDgKUFVCTElDX1VSTD0iJChzdWRvIGdyZXAgLW9FICdodHRwczovL1stYS16MC05XStcLnRyeWNsb3VkZmxhcmVcLmNvbScgL3Zhci9saWIvYWdlbmRhZmFjaWwvY2xvdWRmbGFyZWQubG9nIHwgdGFpbCAtMSB8fCB0cnVlKSIKaWYgWyAteiAiJFBVQkxJQ19VUkwiIF07IHRoZW4KICBlY2hvICJUVU5ORUxfRkFJTEVEIgogIHN1ZG8gdGFpbCAtODAgL3Zhci9saWIvYWdlbmRhZmFjaWwvY2xvdWRmbGFyZWQubG9nIHx8IHRydWUKICBleGl0IDMKZmkKcHJpbnRmICclc1xuJyAiJFBVQkxJQ19VUkwiIHwgc3VkbyB0ZWUgL3Zhci9saWIvYWdlbmRhZmFjaWwvZXZvbHV0aW9uLXB1YmxpYy11cmwgPi9kZXYvbnVsbAplY2hvICJUVU5ORUxfT0siCmVjaG8gInB1YmxpY191cmw9JFBVQkxJQ19VUkwiCmVjaG8gImxvY2FsX3Byb2JlPSQoY3VybCAtc1MgLW8gL2Rldi9udWxsIC13ICcle2h0dHBfY29kZX0nIC0tbWF4LXRpbWUgMTAgaHR0cDovLzEyNy4wLjAuMTo4MDgwLyB8fCB0cnVlKSIK"
}
